Academic Unit,Course Number,Course Title,Credits,Semester,Prerequisites,Restrictions,Offered By,Description
MATH,590,Advanced Set Theory.,4,,MATH 251;MATH 255,MATH 488,Mathematics and Statistics (Faculty of Science),Students will attend the lectures and fulfill all the requirements of MATH 488. In addition; they will complete a project on an advanced topic agreed on with the instructor. Topics may be chosen from combinatorial set theory; Goedel's constructible sets; forcing; large cardinals and descriptive set theory.
MATH,591,Model Theory,4,Winter 2026,MATH 318;MATH 488;MATH 456,,Mathematics and Statistics (Faculty of Science),Structures; theories; and definable sets; elementary equivalence and elementary embeddings; compactness and Löwenheim– Skolem theorems; types; the omitting types theorem; and saturation; categoricity and the Ryll-Nardzewski theorem; quantifier elimination and applications to algebra; ultraproducts; homogeneous structures and Fraïssé theory; infinitary logics. Optional topics: indiscernibles and Morley's theorem; stability; o-minimality; elimination of imaginaries.
MATH,592,Descriptive Set Theory,4,,MATH 454;MATH 451,,Mathematics and Statistics (Faculty of Science),Polish spaces; universality of the Hilbert cube; the Cantor space; and the Baire space; the Cantor–Bendixson theorem; Baire spaces; the Borel hierarchy; change of topology techniques; infinite games; analytic and co-analytic sets; analytic separation; the Luzin–Souslin theorem; the Borel and measure isomorphism theorems; regularity properties of analytic sets; uniformization; the projective hierarchy. Optional topics: Polish groups and their actions; definable equivalence relations and graphs; effective descriptive set theory. 
MATH,594,Topics in Mathematics and Statistics .,4,,,,Mathematics and Statistics (Faculty of Science),This course covers a topic in mathematics and/or statistics. 
MATH,595,Topics in Analysis.,4,,MATH 454;MATH 366;MATH 466,,Mathematics and Statistics (Faculty of Science),This course covers a topic in analysis.
MATH,596,Topics in Algebra and Number Theory.,4,,MATH 456;MATH 377,,Mathematics and Statistics (Faculty of Science),This course covers a topic in algebra and/or number theory.
MATH,597,Topics in Applied Mathematics.,4,,,,Mathematics and Statistics (Faculty of Science),This course covers a topic in applied mathematics.
MATH,598,Topics in Probability & Statistics,0,Fall 2025; Winter 2026,MATH 356,,Mathematics and Statistics (Faculty of Science),This course covers a topic in probability and/or statistics.
MATH,599,Topics in Geometry and Topology.,4,Winter 2026,MATH 454;MATH 458,,Mathematics and Statistics (Faculty of Science),This course covers a topic in geometry and/or topology.
MDPH,396,Undergraduate Research Project.,3,,,,Medical Physics Unit (Faculty of Science),This course cannot be taken under the S/U option. Students cannot be supervised by the same instructor for two 396 Science courses. Open to students in programs offered by the Faculty of Science. Since this course takes place within a clinical department and may require access to confidential data; the proposed research project needs departmental approval and may need research ethics board approval.
MIMM,211,Introductory Microbiology.,3,Fall 2025,,,Microbiology & Immunology (Faculty of Science),A general treatment of microbiology bearing specifically on the biological properties of microorganisms. Emphasis will be on procaryotic cells. Basic principles of microbial genetics are also introduced.
MIMM,212,Laboratory in Microbiology.,3,Fall 2025,,,Microbiology & Immunology (Faculty of Science),This laboratory course is designed to complement MIMM 211. Sessions introduce general techniques peculiar to the handling of microorganisms.
MIMM,214,Introductory Immunology: Elements of Immunity.,3,Winter 2026,BIOL 200,,Microbiology & Immunology (Faculty of Science),Basic immunology; organs and cells; elements of innate immunity; phagocytes; complement; elements of adaptive immunity; B-cells; T-cells; antigen presenting cells; MHC genes and molecules; antigen processing and presentation; cytokines and chemokines. Emphasis on anatomy and the molecular and cellular players working together as a physiological system to maintain human health.
MIMM,301,Scientific Writing Skills in MIMM.,1,Winter 2026,MIMM323;;MIMM324;;MIMM384,,Microbiology & Immunology (Faculty of Science),Scientific and communication skills; including searching the literature; reading primary papers; managing citations and using them appropriately; as well as interpreting scientific data; synthesizing findings from the scientific literature; and writing a scientific paper. This course will allow students to practice scientific writing skills through various steps intended to provide feedback. 
MIMM,314,Intermediate Immunology.,3,Winter 2026,MIMM 214,,Microbiology & Immunology (Faculty of Science),An intermediate-level immunology course covering the cellular and molecular basis of lymphocyte development and activation in immune responses in health and disease.
MIMM,323,Microbial Physiology.,3,Fall 2025,MIMM 211,,Microbiology & Immunology (Faculty of Science),An introduction to the composition and structure of microbial cells; the biochemical activities associated with cellular metabolism and how these activities are regulated and coordinated. The course will have a molecular and genetic approach to the study of microbial physiology.
MIMM,324,Fundamental Virology.,3,Fall 2025,BIOC 212;BIOL 200;BIOL 201;MIMM 211,,Microbiology & Immunology (Faculty of Science),A study of the fundamental properties of viruses and their interactions with host cells. Bacteriophages; DNA- and RNA-containing animal viruses; and retroviruses are covered. Emphasis will be on phenomena occurring at the molecular level and on the regulated control of gene expression in virus-infected cells.
MIMM,384,Molecular Microbiology Laboratory.,3,Fall 2025,MIMM 211;MIMM 212,MIMM 386,Microbiology & Immunology (Faculty of Science),A series of laboratory exercises in molecular biology and microbial genetics during the Fall term. As part of a term paper writing project; students will explore contemporary research subjects that represent the wide interests of the Microbiology and Immunology departmentâ•Žs faculty. The general objective is to provide practical and theoretical introduction to the technology and methodology used in contemporary microbiology research.
MIMM,385,Laboratory in Immunology.,3,Winter 2026,MIMM 211;MIMM 212;MIMM 214;MIMM 384,,Microbiology & Immunology (Faculty of Science),This laboratory course allows students to gain expertise in following protocols and performing key techniques in immunology. Students also develop basic experimental design and scientific thinking skills by designing their own experiments based on available reagents to solve a problem. Students learn to keep a lab book and communicate scientific findings in written and oral form.
MIMM,387,The Business of Science.,3,Winter 2026,,,Microbiology & Immunology (Faculty of Science),The ability to select and manipulate genetic material has led to unprecedented interest in the industrial applications of procaryotic and eucaryotic cells. Beginning in the 1970s the introduction of and subsequent refinements to recombinant DNA technology and hybridoma technology transformed the horizons of the biopharmaceutical world. This course will highlight the important events that link basic research to clinical/commercial application of new drugs and chemicals.
MIMM,390,SEA-PHAGES: Phage Discovery.,3,Fall 2025,BIOL 200;MIMM 211;MIMM 212,,Microbiology & Immunology (Faculty of Science),Microbiology and molecular biology content about bacteriophages; followed by hands-on experience through isolation and characterization of novel bacteriophages from soil samples using various microbiology and virology techniques.
MIMM,391,SEA-PHAGES: Genome Annotation.,3,Winter 2026,BIOL 200;MIMM 211;MIMM 212,,Microbiology & Immunology (Faculty of Science),Introduction to bioinformatics as a tool to further bacteriophage research by using computer programs and software to annotate genomes of bacteriophages.
MIMM,396,Undergraduate Research Project in Microbiology.,3,Summer 2025; Fall 2025; Winter 2026,,,Microbiology & Immunology (Faculty of Science),Independent research project with a final written report.
MIMM,397,Undergraduate Research Project in Immunology.,3,Summer 2025; Fall 2025; Winter 2026,,,Microbiology & Immunology (Faculty of Science),Independent research project with a final written report.
MIMM,413,Parasitology.,3,Winter 2026,ANAT 261;MIMM 314,,Microbiology & Immunology (Faculty of Science),A study of the biology; immunological aspects of host-parasite interactions; pathogenicity; epidemiology and molecular biological aspects of selected parasites of medical importance. Laboratory will consist of a lecture on techniques; demonstrations and practical work.
MIMM,414,Advanced Immunology.,3,Fall 2025,MIMM 314,,Microbiology & Immunology (Faculty of Science),An advanced course serving as a logical extension of MIMM 314. The course will integrate molecular; cellular and biochemical events involved in the ontogeny of the lymphoid system and its activation in the immune response. The course will provide the student with an up-to-date understanding of a rapidly moving field.
MIMM,465,Bacterial Pathogenesis.,3,Fall 2025,MIMM 214;MIMM 323;MIMM 384,,Microbiology & Immunology (Faculty of Science),Familiarizes students with key principles and recent advances in our understanding of the strategies that bacteria use to infect and cause disease; as well as the approaches used in the prevention and treatment of bacterial infections.
MIMM,466,Viral Pathogenesis.,3,Winter 2026,MIMM 211;MIMM 324;MIMM 314,,Microbiology & Immunology (Faculty of Science),A study of the biological and molecular aspects of viral pathogenesis with emphasis on the human pathogenic viruses including the retroviruses HIV and HTLV-1; herpes viruses; papilloma viruses; hepatitis viruses; and new emerging human viral diseases. These viruses will be discussed in terms of virus multiplication; gene expression virus-induced cytopathic effects and host immune response to infection.
MIMM,496D1,Microbiology Advanced Research Project.,3,Summer 2025; Fall 2025,MIMM 212;MIMM 384;MIMM 385,,Microbiology & Immunology (Faculty of Science),This two-semester course is intended for undergraduate Science students who want a rigorous research experience beyond that of a one semester course (MIMM 396/397) and who are unlikely to take the Honours Research Project course (MIMM 501/502). 
MIMM,496D2,Microbiology Advanced  Research Project .,3,Fall 2025; Winter 2026,MIMM 496;MIMM 212;MIMM 384;MIMM 385,,Microbiology & Immunology (Faculty of Science),For description see MIMM 496D1.
MIMM,497,Immunology Advanced Research Project.,6,,,,Microbiology & Immunology (Faculty of Science),This two-semester course is intended for undergraduate Science students who want a rigorous research experience beyond that of a one semester course (MIMM 396/397) and who are unlikely to take the Honours Research Project course (MIMM 501/502). 
MIMM,497D1,Immunology Advanced Research Project.,3,Summer 2025; Fall 2025,MIMM 212;MIMM 384;MIMM 385,,Microbiology & Immunology (Faculty of Science),This two-semester course is intended for undergraduate Science students who want a rigorous research experience beyond that of a one semester course (MIMM 396/397) and who are unlikely to take the Honours Research Project course (MIMM 501/502). 
MIMM,497D2,Immunology Advanced Research Project.,3,Fall 2025; Winter 2026,MIMM 497;MIMM 212;MIMM 384;MIMM 385,,Microbiology & Immunology (Faculty of Science),See MIMM 497D1 for description.
MIMM,498,Library Research Project in Immunology.,1,Fall 2025; Winter 2026,MIMM 314;MIMM 323;MIMM 324;MIMM 386,,Microbiology & Immunology (Faculty of Science),Supervised exploration of the current scientific literature on an assigned topic of an advanced nature within the  area of Immunology.
MIMM,499,Library Research Project in Microbiology.,1,Fall 2025; Winter 2026,MIMM 314;MIMM 323;MIMM 324;MIMM 386,,Microbiology & Immunology (Faculty of Science),Supervised exploration of the current scientific literature on an assigned topic of an advanced nature within the general areas of bacteriology; virology; or parasitology.
MIMM,501D1,Honours Research Project in Immunology.,6,Fall 2025,,MIMM 502,Microbiology & Immunology (Faculty of Science),Presentation of students' research findings in a seminar and a final written report.
MIMM,501D2,Honours Research Project in Immunology.,6,Winter 2026,MIMM 501,,Microbiology & Immunology (Faculty of Science),See MIMM 501D1 for course description.
MIMM,502D1,Honours Research Project in Microbiology.,6,Fall 2025,,,Microbiology & Immunology (Faculty of Science),Presentation of students' research findings in a seminar and a final written report.
MIMM,502D2,Honours Research Project in Microbiology.,6,Winter 2026,MIMM 502,,Microbiology & Immunology (Faculty of Science),See MIMM 502D1 for course description.
MIMM,509,Inflammatory Processes.,3,Winter 2026,MIMM 314,,Microbiology & Immunology (Faculty of Science),This course concentrates on the non-specific aspects of the immune response; an area which is not adequately covered by the other immunology courses presented at the university. Interactions between guest researchers (from McGill and other universities) and students will be furthered.
MIMM,510,New Advances in Antimicrobial Drugs .,3,,,,Microbiology & Immunology (Faculty of Science),Overview on bacteria; insights into bacterial pathogenesis; an understanding of antibiotics; and new developments in antibacterial to beat antibiotic resistance.
NEUR,310,Cellular Neurobiology.,3,Winter 2026,ANAT 321;ANAT 322;BIOL 201;BIOL 306;PHGY 209;PHGY 210;PHGY 311,,Neurology and Neurosurgery (Faculty of Science),A survey of the functional organization of nerve cells; signalling in the nervous system; and principles of neural development. Topics include cell polarity; neurotransmitters; neurotrophins; receptors and second messengers; cell lineage; guidance of axon outgrowth; and nerve regeneration. Emphasis will be placed on analysis of neurons at the molecular level.
NSCI,200,Introduction to Neuroscience 1.,3,Fall 2025,BIOL 112;BIOL 200;CHEM 110;CHEM 120;CHEM 212;PHYS 101;PHYS 131;PHYS 102;PHYS 142,PHGY 209,Physiology (Faculty of Science),An introduction to how nerve cells generate action potentials; communicate with one another at synapses; develop synaptic connections; early brain development; and the construction of specific neural circuits.
NSCI,201,Introduction to Neuroscience 2.,3,Winter 2026,NSCI 200;PSYC 211,PSYC 308,Psychology (Faculty of Science),An introduction to how the nervous system acquires and integrates information and uses it to produce behaviour.
NSCI,300,Neuroethics.,3,,NSCI 200;NSCI 201,,Physiology (Faculty of Science),An introduction to ethical issues arising from basic and clinical neuroscience. Overview of therapeutic; diagnostic; and research interventions in mental and neurological disorders; and their implications on society.
NSCI,396,Undergraduate Research Project.,3,Fall 2025; Winter 2026,,,Biology (Faculty of Science),Independent research project with a final written report.
NSCI,400D1,Neuroscience Seminar.,0,Fall 2025,NSCI 200,,Physiology (Faculty of Science),Analysis of current research in neuroscience.
NSCI,400D2,Neuroscience Seminar.,0,Winter 2026,NSCI 400,,Physiology (Faculty of Science),See NSCI 400D1 for course description.
NSCI,400N1,Neuroscience Seminar.,0,,NSCI 200,,Physiology (Faculty of Science),Analysis of current research in neuroscience.
NSCI,400N2,Neuroscience Seminar.,0,,NSCI 400,,Physiology (Faculty of Science),See NSCI 400N1 for course description.
NSCI,410,Independent Research 1.,6,Fall 2025; Winter 2026,NSCI 200;NSCI 201,NSCI 420;NSCI 420,Biology (Faculty of Science),Independent laboratory research in neuroscience.
NSCI,410D1,Independent Research 1.,3,Fall 2025,NSCI 200;NSCI 201,NSCI 420;NSCI 420,Biology (Faculty of Science),Independent laboratory research in neuroscience.
NSCI,410D2,Independent Research 1.,3,Winter 2026,NSCI 410,,Biology (Faculty of Science),See NSCI 410D1 for course description.
NSCI,420,Independent Research 2.,9,,NSCI 200;NSCI 201,,Biology (Faculty of Science),Independent laboratory research in neuroscience.
NSCI,420D1,Independent Research 2.,4,Fall 2025,NSCI 200;NSCI 201,NSCI 410,Biology (Faculty of Science),Independent laboratory research in neuroscience.
NSCI,420D2,Independent Research 2.,4,Winter 2026,NSCI 420,NSCI 410,Biology (Faculty of Science),See NSCI 420D1 for course description.
NSCI,420N1,Independent Research 2.,4,,NSCI 200;NSCI 201,NSCI 410,Biology (Faculty of Science),Independent laboratory research in neuroscience.
NSCI,420N2,Independent Research 2.,4,,NSCI 420,,Biology (Faculty of Science),See NSCI 420N1 for course description.
NSCI,430D1,Honours Research Project.,4,Fall 2025,NSCI 200;NSCI 201;NSCI 300,,Biology (Faculty of Science),Students undertake an independent research project in the field of neursocience under the guidance of an established McGill neuroscientist. They are expected to obtain hands-on research experience in their supervisor's laboratory; learn about the strengths and limitations of the methodology and work independently.
NSCI,430D2,Honours Research Project.,4,Winter 2026,NSCI 430,,Biology (Faculty of Science),Students undertake an independent research project in the field of neursocience under the guidance of an established McGill neuroscientist. They are expected to obtain hands-on research experience in their supervisor's laboratory; learn about the strengths and limitations of the methodology and work independently.
PATH,300,Human Disease.,3,Winter 2026,BIOC 212;BIOL 200;BIOL 201;PHGY 209;PHGY 210,,Pathology (Faculty of Science),Provides a fundamental understanding of the diseases prevalent in North America; for upper level students in the biological sciences. Includes: general responses of cells and organ systems to injury; assessment of individual diseases by relating the causes; symptoms; diagnosis; treatment and prevention to the primary biological abnormalities in each disorder.
PATH,396,Undergraduate Research Project in  Pathology.,3,Summer 2025; Fall 2025,,,Pathology (Faculty of Science),Independent research project with a final written report.
PHAR,200,Introduction to Pharmacology 1.,1,Fall 2025,,,Pharmacology and Therapeutics (Faculty of Science),The objective of this course is to give U1 Pharmacology Major program students an appreciation of research in Pharmacology. The focus will be on contributions of this research to our understanding of how drugs work; strategies towards the discovery of new drugs; and/or on how use of current drugs may be improved based on this understanding.
PHAR,201,Introduction to Pharmacology 2.,1,Winter 2026,PHAR 200,,Pharmacology and Therapeutics (Faculty of Science),This course will be a continuation of PHAR 200; taught in the fall semester. The focus will be on contributions of this research to our understanding of how drugs work; strategies towards the discovery of new drugs; and/or on how use of current drugs may be improved based on this understanding.
PHAR,300,Drug Action.,3,Fall 2025,ANAT/BIO;BIOL 200;BIOL 201;PHGY 209;PHGY 210,,Pharmacology and Therapeutics (Faculty of Science),Principles of pharmacology and toxicology. Frequently encountered drugs will be used as a focus to illustrate sites and mechanisms of action; distribution; metabolism; elimination and adverse side effects.
PHAR,301,Drugs and Disease.,3,Winter 2026,PHAR 300,,Pharmacology and Therapeutics (Faculty of Science),This course further explores the basic principles of pharmacology as illustrated by drugs used in the treatment of disease. Emphasis is placed on drugs used for diseases prevalent in North America.
PHAR,303,Principles of Toxicology.,3,Winter 2026,BIOC 212;BIOL 200;BIOL 201;PHGY 209;PHGY 210,,Pharmacology and Therapeutics (Faculty of Science),Fundamental mechanisms by which toxic compounds damage a biological system (organelle; cell; organ; organism; ecosystem). Detection and quantification of toxicity and risk/benefit analysis are considered. Selected agents of current risk to human health or the environment are evaluated in depth.
PHAR,390,Laboratory in Pharmacology.,3,Summer 2025,,,Pharmacology and Therapeutics (Faculty of Science),This course is a two-week all day practical laboratory course where students will have the opportunity to design their own experiments; write out the experimental lab reports and learn to trouble shoot on their own.
PHAR,396,Undergraduate Research Project.,3,Summer 2025; Fall 2025; Winter 2026,,,Pharmacology and Therapeutics (Faculty of Science),Independent research project with a final written report and an oral presentation.
PHAR,397,Pharmacology Research Project 2.,3,Summer 2025,PHAR 396,,Pharmacology and Therapeutics (Faculty of Science),Research project to be carried out under supervision of a faculty member in the Department of Pharmacology and Therapeutics. Projects should address a testable hypothesis to be tested using the experimental tools available in the supervisor’s lab and probably other facilities at McGill. Hands-on experience with contemporary research in pharmacology and related disciplines.
PHAR,503,Drug Discovery and Development 1.,3,Fall 2025,PHAR 301;PHAR 303,,Pharmacology and Therapeutics (Faculty of Science),Chemistry; mechanisms of action; and steps in drug discovery and development.
PHAR,504,Drug Discovery and Development 2.,3,Winter 2026,PHAR 301;PHAR 303,,Pharmacology and Therapeutics (Faculty of Science),Nobel Prize-winning discoveries as a basis for drug development.
PHAR,505,Structural Pharmacology.,3,Fall 2025,BIOC 311;PHAR 301,PHAR 503,Pharmacology and Therapeutics (Faculty of Science),The course will cover approaches widely used in the pharmaceuticals industry; such as drug target selection; structure determination and medicinal chemistry. The basics of structural biology will be taught in a very visual and interactive manner; with an emphasis on drug:target interactions and chemical principles relevant to drug design. By the end of the course; the students will become familiar with the structure-based drug discovery process and principles of molecular pharmacology.
PHAR,508,Drug Discovery and Development 3.,3,Winter 2026,PHAR 301;PHAR 503;PHAR 505,,Pharmacology and Therapeutics (Faculty of Science),The design of biologically-relevant drug screens for molecular targets in a cell; tissue; and in vivo setting. Explore the use of stem cells and tissue-based disease models for the understanding of disease and for drug discovery. Situate modern pharmacology into broader medical and societal issues such as personalized medicine and the ethics associated with research.
PHAR,510,New Advances in Antimicrobial.,3,,,MIMM and;MIMM 510;PHAR stu,Pharmacology and Therapeutics (Faculty of Science),Overview on bacteria; insights into bacterial pathogenesis; an understanding of antibiotics; and new developments in antibacterial to beat antibiotic resistance. 
PHAR,540,Advances in Industrial Biotechnology .,3,Winter 2026,BIOL 200;CHEM 222;CHEM 332,CHEM 540,Pharmacology and Therapeutics (Faculty of Science),Introduction to emerging technologies and research advances in biotechnologies. Topics include semisynthetic production of drugs and drug candidates through large-scale fermentation; next generation synthesis of DNA and whole genes; green toxicology; single-molecule diagnostics; orphan-drug re-purposing; and next- generation genomic analyses in drug development. Translational research; issues of entrepreneurship; sustainability; and ethics are also covered. 
PHAR,562,Neuropharmacology.,3,Fall 2025,PHAR 301,,Pharmacology and Therapeutics (Faculty of Science),Topics in pharmacology with an emphasis on molecular mechanisms of drug-action and cellular targets in the nervous system.
PHAR,563,Endocrine Pharmacology.,3,Fall 2025,PHAR 301,,Pharmacology and Therapeutics (Faculty of Science),This advanced course covers selected topics in pharmacology of reproductive; endocrine; and metabolic disorders.
PHAR,565,Epigenetic Drugs and Targets.,3,Winter 2026,PHAR 301,HGEN 673,Pharmacology and Therapeutics (Faculty of Science),This course covers therapeutics targeting epigenetic mechanisms. Although only a handful of epigenetic drugs are in widespread use; further development of such agents is a very active area of research as it has the potential to directly target aberrant gene expression. This course will examine both the current use and potential of epigenetic drugs in treatment of cancer; neurological diseases; immune disorders; and cardiovascular disease. The concept of epigenetics as mediating gene-environment interaction will also be discussed.
PHAR,590,Advanced Research Methods in Pharmacology .,3,,PHAR 390,,Pharmacology and Therapeutics (Faculty of Science),Investigation into the signaling; regulation and modulation of a large family of receptors of fundamental importance in pharmacology.
PHAR,598,Honours Pharmacology Research Project.,6,,,,Pharmacology and Therapeutics (Faculty of Science),Supervised Honours Research Project in Pharmacology.  Students are expected to obtain hands-on research experience in their supervisor's laboratory.  They are also required to submit a written report in the form of a scientific manuscript and present a ten minute seminar.
PHAR,598D1,Honours Pharmacology Research Project.,3,Fall 2025,,,Pharmacology and Therapeutics (Faculty of Science),Supervised Honours Research Project in Pharmacology.  Students are expected to obtain hands-on research experience in their supervisor's laboratory.  They are also required to submit a written report in the form of a scientific manuscript and present a ten minute seminar.
